GROWP,SUBGROUP,CLASS,PROGRAM,NAME,DATA
9,2,1,5,<<Ուսուցչի օրվա>> առթիվ  հանրակրթական ուսումնական հաստատությունների լավագույն մանկավարժների պարգեւատրում,2021
9,2,2,0,Միջնակարգ (լրիվ)  ընդհանուր կրթություն,2021
9,2,2,1,Երեկոյան  ուսուցում,2021
9,2,2,2,Հանրակրթական ուսուցում,2021
9,2,2,3,Հատուկ կրթություն,2021
9,2,2,4,Ներառական կրթություն,2021
9,2,2,5,Մասնագիտացված հանրակրթական ուսուցում,2021
9,2,2,6,Ներդրումներ ուսումնական հաստատություններում,2021
9,3,0,0,Նախնական մասնագիտական (արհեստագործական) եւ միջին մասնագիտական կրթություն,2021
9,3,1,0,Նախնական մասնագիտական (արհեստագործական) կրթություն,2021
9,3,1,1,Նախնական մասնագիտական (արհեստագործական) կրթություն,2021
9,3,1,2,Նախնական մասնագիտական  (արհեստագործական) կրթություն ստացող ուսանողների կրթաթոշակ,2021
9,3,2,0,Միջին մասնագիտական կրթություն,2021
9,3,2,1,Միջին մասնագիտական կրթության գծով ուսանողական նպաստների տրամադրում,2021
9,3,2,2,Միջին մասնագիտական կրթություն ստացող ուսանողների կրթաթոշակ,2021
9,3,2,3,Ռազմական դրությամբ պայմանավորված միջին մասնագիտական կրթական ծրագրեր իրականացնող ուսումնական հաստատությունների սովորողների ուսման վարձի փոխհատուցում,2021
9,3,2,4,Հայաստանի Հանրապետության միջին մասնագիտական ուսումնական հաստատություններում սովորող սփյուռքահայ ուսանողների ուսման վճարի փոխհատուցում,2021
9,4,0,0,Բարձրագույն կրթություն,2021
9,4,1,0,Բարձրագույն մասնագիտական կրթություն,2021
9,4,1,1,Բարձրագույն մասնագիտական կրթություն,2021
9,4,1,2,Բարձրագույն մասնագիտական կրթության գծով ուսանողական նպաստների տրամադրում,2021
9,4,1,3,Բարձրագույն մասնագիտական կրթություն ստացող ուսանողների կրթաթոշակ,2021
9,4,1,4,Ռազմական դրությամբ պայմանավորված բարձրագույն կրթական ծրագրեր իրականացնող ուսումնական հաստատությունների սովորողների ուսման վարձի փոխհատուցում,2021
9,4,1,5,Հայաստանի Հանրապետության բարձրագույն ուսումնական հաստատություններում սովորող սփյուռքահայ ուսանողների ուսման վճարի փոխհատուցում,2021
9,4,1,6,Օժանդակություն ԲՈՒՀ-ին ընթացիկ գործունեության ապահովման համար,2021
9,4,1,7,Բուհի տարածքում տեղակայված պետական մարմինների բնականոն գործունեության ապահովում,2021
9,4,2,0,Հետբուհական մասնագիտական կրթություն,2021
9,4,2,1,Գիտական կադրերի պատրաստման գծով նպաստների տրամադրում,2021
9,4,2,2,Ասպիրանտական եւ դոկտորանտական կրթաթոշակներ,2021
9,4,2,3,Հետբուհական մասնագիտական կրթության գծով նպաստների տրամադրում,2021
9,4,2,4,Հետբուհական մասնագիտական կրթություն ստացող ուսանողների կրթաթոշակ,2021
9,5,0,0,Ըստ մակարդակների չդասակարգվող կրթություն,2021
9,5,1,0,Արտադպրոցական դաստիարակություն,2021
9,5,1,1,Աջակցություն արտադպրոցական դաստիարակությանը,2021
9,5,1,2,Արտադպրոցական դաստիարակություն,2021
9,5,1,3,Արտադպրոցական դաստիարակություն հասարակական կազմակերպությունների կողմից,2021
9,5,1,4,"Երաժշտական եւ արվեստի դպրոցներում ազգային, փողային եւ լարային նվագարանների գծով ուսուցում",2021
9,5,1,5,Հայաստանի Հանրապետության համայնքային բյուջեներին  սուբվենցիաների տրամադրում,2021
9,5,1,6,Երաժշտական եւ արվեստի դպրոցներում  ուսումնամեթոդական աշխատանքներ,2021
9,5,1,7,Երաժշտական եւ արվեստի դպրոցների համար ուսումնամեթոդական գրականության մշակում եւ հրատարակում,2021
9,5,1,8,Մանկապատանեկան մարզադպրոցներում աշխատող մարզիչ-մանկավարժների վերապատրաստման կազմակերպում,2021
9,5,1,9,«Հակոբ Կոջոյան» կրթահամալիր» ՊՈԱԿ-ում արտադպրոցական դաստիարակության կազմակերպման նպատակով պետության կողմից համայնքի ղեկավարին պատվիրակված լիազորությունների իրականացման ֆինանսավորում,2021
9,5,1,10,Աջակցություն իրավախախտում կատարած անչափահասների գեղագիտական դաստիարակության ծրագրերի իրականացմանը,2021
9,5,1,11,Երաժշտական եւ արվեստի դպրոցների համար երաժշտական գործիքների ձեռքբերում,2021
9,5,1,12,Աջակցություն շնորհալի պատանի երաժիշտ-կատարողների մասնագիտական կարողությունների զարգացմանը եւ կատարելագործմանը,2021
9,5,1,13,"Ազգային, փողային եւ լարային նվագարանների գծով ուսուցում",2021
9,5,1,14,«Դասական երաժշտություն «Դաս A»,2021
9,5,1,15,Քո գիտությունը դպրոցում,2021
9,5,1,16,ՀՀ հանրակրթական ծրագրեր իրականացնող ուսումնական հաստատությունների 11-րդ դասարանների աշակերտների ռազմամարզական ճամբարի կազմակերպում,2021
9,5,1,17,Մարզադպրոցների գույքային եւ տեխնիկական ապահովվածության բարելավում,2021
9,5,1,18,Դպրոցականների ամառային հանգստի կազմակերպում,2021
9,5,1,19,Արտադպրոցական դաստիարակություն իրականացնող կազմակերպությունների շենքային պայմանների բարելավում,2021
9,5,2,0,Լրացուցիչ կրթություն,2021
9,5,2,1,ՀՀ քաղաքացիական ծառայողների վերապատրաստման գծով պետական պատվեր,2021
9,5,2,2,Հանրային հատվածի ֆինանսական ոլորտի մասնագետների վերապատրաստման ծառայություններ,2021
9,5,2,3,Լրացուցիչ կրթության ուսուցման գծով պետական պատվեր,2021
9,5,2,4,ՀՀ արդարադատության նախարարության հատուկ ծառայողների վերապատրաստում եւ հատուկ ուսուցում,2021
9,5,2,5,Ընտրական հանձնաժողովների անդամների մասնագիտական դասընթացների կազմակերպում,2021
9,5,2,6,Կադրերի պատրաստման եւ վերապատրաստման ծառայություններ,2021
9,5,2,7,Օտարերկրյա պետությունների ուսումնական հաստատություններ գործուղված փրկարարական ծառայողների ուսուցում,2021
9,5,2,8,ՀՀ Ազգային Ժողովի աշխատակազմի պետական ծառայողների վերապատրաստում,2021
9,5,2,9,Վերապատրաստման ծառայություններ,2021
9,5,2,10,Մասնագիտական վերապատրաստում ստացող ունկնդիրների կրթաթոշակ,2021
9,5,2,11,Հարկային եւ մաքսային ծառայողների վերապատրաստման ծառայություններ,2021
9,5,2,12,Կոռուպցիայի դեմ պայքարին առնչվող հարցերով կրթական եւ հանրային իրազեկվածության բարձրացմանն ուղղված ծրագրերի մշակում եւ միջոցառումների իրականացում,2021
9,5,2,13,Աշխատակազմի մասնագիտական կարողությունների զարգացում,2021
9,5,2,14,Աշխատակազմի մասնագիտական զարգացման ծառայություններ,2021
9,5,2,15,Աշխատակազմի մասնագիտական զարգացման ծառայություններ,2021
9,6,0,0,Կրթությանը տրամադրվող օժանդակ ծառայություններ,2021
9,6,1,0,Կրթությանը տրամադրվող օժանդակ ծառայություններ,2021
9,6,1,1,Միջազգային կազմակերպություններին Հայաստանի Հանրապետության անդամակցության վճարներ,2021
9,6,1,2,Կրթական օբյեկտների հիմնանորոգում,2021
9,6,1,3,Միջին մասնագիտական ուսումնական հաստատությունների հիմնանորոգում,2021
9,6,1,4,Ուսանողներին զեղչային գներով հանրակացարանային պայմանների տրամադրում,2021
9,6,1,5,"Ավարտական փաստաթղթերի, գովասանագրերի, դասամատյանների, մեդալների, ծրարների, ուսումնական ծրագրերի, մանկավարժական պարբերականների եւ ուսումնադիտողական պարագաների ձեռքբերում",2021
9,6,1,6,Տարրական դասարանների աշակերտներին անվճար դասագրքերով եւ ուսումնական գրականությամբ ապահովում ու ավագ դպրոցների դասագրքերի հրատարակում,2021
9,6,1,7,"Փոխհատուցում ՀՀ հեռավոր, սահմանամերձ, լեռնային եւ բարձր լեռնային բնակավայրերի պետական հանրակրթական դպրոցների մանկավարժներին",2021
9,6,1,8,Հանրակրթական դպրոցների մանկավարժներին եւ դպրոցահասակ երեխաներին տրանսպորտային ծառայությունների  մատուցում,2021
9,6,1,9,Ռազմագիտության կաբինետները ուսումնաօժանդակ նյութերով ապահովում,2021
9,6,1,10,Դպրոցականների օլիմպիադաների անցկացում,2021
9,6,1,11,Փորձարարական մանկավարժական ծրագրերի իրականացում հանրակրթությունում,2021
9,6,1,12,Ակադեմիական փոխճանաչման եւ շարժունության  ծառայություններ,2021
9,6,1,13,Բարձրագույն մասնագիտական կրթության գնահատման համակարգի բարեփոխումներ,2021
9,6,1,14,Կրթության բովանդակային եւ մեթոդական սպասարկում  ու  հանրապետության հանրակրթական դպրոցների ուսուցիչների վերապատրաստում,2021
9,6,1,15,Նախնական մասնագիտական (արհեստագործական) եւ միջին մասնագիտական կրթության եւ ուսուցման (ՄԿՈՒ) բարեփոխումներ,2021
9,6,1,16,Սոցիալապես անապահով ընտանիքների երեխաների դասագրքերի վարձավճարների փոխհատուցում,2021
9,6,1,17,Աջակցություն արտասահմանում սովորող ուսանողներին,2021
9,6,1,18,Ատեստավորման միջոցով որակավորում ստացած ուսուցիչներին հավելավճարների տրամադրում,2021
9,6,1,19,Դպրոցահասակ երեխաներին սննդով ապահովում,2021
9,6,1,20,"Աուտիզմ եւ զարգացման այլ խանգարումներ ունեցող երեխաների բուժման, վերականգնման, կրթության եւ զբաղվածության ապահովում",2021
9,6,1,21,«Ուանողներին ուսումնական վարկերի տրամադրում» պետական նպատակային ծրագրի համաֆինանսավորում,2021
9,6,1,22,Համաշխարհային բանկի աջակցությամբ  իրականացվող Կրթության բարելավման ծրագիր,2021
9,6,1,23,«Ազգային երգ ու պար» առարկայի ներդրում հանրակրթական  ուսումնական հաստատություններում,2021
9,6,1,24,Դպրոցներում ռոբոտատեխնիկայի զարգացման իրականացում,2021
9,6,1,25,Ասիական զարգացման բանկի աջակցությամբ իրականացվող Դպրոցների սեյսմիկ պաշտպանության ծրագիր,2021
9,6,1,26,Մանկավարժահոգեբանական աջակցության ծառայություններ,2021
9,6,1,27,«Ներառական կրթության համակարգի հզորացում Հայաստանում» դրամաշնորհային ծրագիր,2021
9,6,1,28,Ուսուցիչների կամավոր ատեստավորման համակարգի ներդրում,2021
9,6,1,29,Փոքրաքանակ երեխաներով համալրված հանրակրթական դպրոցների  մոդուլային շենքերի կառուցման աշխատանքների նախագծա-նախահաշվային փաստաթղթերի մշակում,2021
9,6,1,30,"Համաշխարհային բանկի աջակցությամբ իրականացվող «Կրթության բարելավման ծրագիր» ծրագրի շրջանակներում կապիտալ ներդրումներ ավագ, միջնակարգ եւ հիմնական դպրոցներում եւ կրթության ոլորտի կազմակերպություններում /ԿՏԱԿ/",2021
9,6,1,31,Ասիական զարգացման բանկի աջակցությամբ իրականացվող դպրոցների սեյսմիկ անվտանգության բարելավմանն ուղղված միջոցառումներ,2021
9,6,1,32,«Քո արվեստը դպրոցում»,2021
9,6,1,33,Օժանդակություն «Հայ-չինական բարեկամության դպրոց» հիմնադրամին,2021
9,6,1,34,Մանկապատանեկան եւ երիտասարդական կրթական ու կրթամշակութային միջոցառումների կազմակերպում,2021
9,6,1,35,Սփյուռքի կրթօջախների ուսուցիչների կարողությունների հզորացում,2021
9,6,1,36,"Սփյուռքի կրթօջախների համար դասագրքերի եւ այլ ուսումնական նյութերի մշակում, ձեռքբերում եւ տրամադրում",2021
9,6,1,37,Օտարերկրյա պետություններում հայերենի եւ հայագիտական առարկաների դասավանդում,2021
9,6,1,38,Կրթամշակութային աջակցություն սփյուռքի համայնքներին,2021
9,6,1,39,2022 թվականին ՀՀ-ում կենսաբանության միջազգային օլիմպիադայի անցկացում,2021
9,6,1,40,Նախադպրոցական այլընտրանքային ծախսաարդյունավետ մոդելների ներդրում,2021
9,6,1,41,Հանրակրթական դպրոցների աշակերտներին անվանական կրթաթոշակի տրամադրում,2021
9,6,1,42,Հանրակրթական դպրոցների ուսուցիչների եւ ուսուցչի օգնականների ներառական դասավանդման հմտությունների զարգացման ապահովում,2021
9,6,1,43,Հայաստանի միգրանտ ընտանիքների դպրոցականների հայոց լեզվի իմացության բարելավում,2021
9,6,1,44,ՀՀ Ազգային ժողովի դերի բարձրացմանն  ուղղված միջոցառումների իրականացում,2021
9,6,1,45,«Ուսուցչի օրվա» առթիվ  հանրակրթական ուսումնական հաստատությունների դաստիարակներին պարգեւատրում,2021
9,6,1,46,Հայաստանում «STARMUS» փառատոնի կազմակերպման եւ անցկացման մասնակցության վճար,2021
9,6,1,47,Միջին մասնագիտական կրթության որակի ապահովման ծառայություններ,2021
9,6,1,48,Բարձրագույն կրթության որակի ապահովման ծառայություններ,2021
9,6,1,49,Գնահատման եւ թեստավորման ծառայություններ,2021
9,7,0,0,Կրթության ոլորտում հետազոտական եւ նախագծային աշխատանքներ,2021
9,7,1,0,Կրթության ոլորտում հետազոտական եւ նախագծային աշխատանքներ,2021
9,8,0,0,Կրթություն (այլ դասերին չպատկանող),2021
9,8,1,0,Կրթություն (այլ դասերին չպատկանող),2021
9,8,1,1,"Գործադիր իշխանության, պետական կառավարման հանրապետական եւ տարածքային կառավարման մարմինների  պահպանում",2021
9,8,1,2,"Գործադիր իշխանության, պետական կառավարման հանրապետական եւ տարածքային կառավարման մարմինների  կարողությունների զարգացում",2021
9,8,1,3,Գիտական որակավորման պարբերական գործընթացի համակարգում եւ մոնիտորինգ,2021
9,8,1,4,Լեզվի բնագավառում պետական քաղաքականության մշակման եւ իրականացման ծառայություններ,2021
9,8,1,5,"Հասարակության եւ պետության հանդեպ հատուկ ծառայություններ ունեցած քաղաքացիների մահվան դեպքում հրաժեշտի ծիսակատարության եւ թաղման կազմակերպում, գերեզմանի բարեկարգման եւ մահարձանի պատրաստման ու տեղադրման աշխատանքներին աջակցություն",2021
9,8,1,6,",Հորիզոն-2020. հետազոտությունների եւ նորարարության շրջանակային ծրագիր (2014-2020)ե Միության ծրագրին մասնակցության եւ միջազգային գիտական կառույցներին անդամակցության ապահովում",2021
9,8,1,7,Արտասահմանյան պաշտոնական գործուղումներ,2021
9,8,1,8,"Հասարակության եւ պետության հանդեպ հատուկ ծառայություններ ունեցած քաղաքացիների մահվան դեպքում հրաժեշտի ծիսակատարության եւ թաղման կազմակերպում, գերեզմանի բարեկարգման եւ մահարձանի պատրաստման ու տեղադրման աշխատանքներին աջակցություն",2021
9,8,1,9,"ՀՀ կրթության, գիտության, մշակույթի եւ սպորտի բնագավառում օժանդակ ծրագրեր իրականացնող կազմակերպությունների շենքային պայմանների բարելավում",2021
9,8,1,10,Արտասահմանյան պատվիրակությունների ընդունելություններ,2021
10,0,0,0,ՍՈՑԻԱԼԱԿԱՆ ՊԱՇՏՊԱՆՈՒԹՅՈՒՆ,2021
10,1,0,0,Վատառողջություն եւ անաշխատունակություն,2021
10,1,1,0,Վատառողջություն,2021
10,1,1,1,"Աշխատողների աշխատանքային պարտականությունների կատարման հետ կապված խեղման, մասնագիտական հիվանդության եւ առողջության այլ վնասման հետեւանքով պատճառված վնասի փոխհատուցում",2021
10,1,2,0,Անաշխատունակություն,2021
10,1,2,1,"Հաշմանդամներին  պրոթեզաօրթոպեդիկ պարագաներով, վերականգնման, տեխնիկական միջոցներով  ապահովում եւ դրանց վերանորոգում",2021
10,1,2,2,Մտավոր խնդիրներ ունեցող հաշմանդամ դեռահասների եւ երիտասարդների ցերեկային խնամքի սոցիալ- վերականգնողական ծառայություններ,2021
10,1,2,3,Եվրոպական արտադրության լսողական սարքերի ձեռքբերման համար հավաստագրերի տրամադրում,2021
10,1,2,4,Հաշմանդամություն ունեցող երեխաների եւ երիտասարդների սոցիալ- հոգեբանական աջակցություն ցերեկային կենտրոնում,2021
10,1,2,5,Աուտիզմ ունեցող դեռահասներին եւ երիտասարդներին զբաղվածության եւ սոցիալ-հոգեբանական ծառայությունների տրամադրում «Իմ ուղին» սոցիալ-աբիլիտացիոն ցերեկային կենտրոնում,2021
10,1,2,6,Հոգեկան առողջության խնդիրներ ունեցող անձանց շուրջօրյա խնամքի ծառայություններ,2021
10,1,2,7,Մտավոր խնդիրներ ունեցող անձանց շուրջօրյա խնամքի ծառայություններ,2021
10,1,2,8,"Էկզոսկելետոնի ձեռքբերում վերականգնողական կենտրոնին տրամադրելու նպատակով, օժանդակություն հաշմանդամություն ունեցող անձանց վերականգնման գործընթացին",2021
10,1,2,9,Հաշմանդամություն ունեցող անձանց աջակցող տեխնոլոգիաներով ապահովում եւ դրանց վերանորոգում,2021
10,2,0,0,Ծերություն,2021
10,2,1,0,Ծերություն,2021
10,2,1,1,Սպայական անձնակազմի եւ նրանց ընտանիքների անդամների կենսաթոշակներ,2021
10,2,1,2,Շարքային զինծառայողների եւ նրանց ընտանիքների անդամների կենսաթոշակներ,2021
10,2,1,3,"Ծերության, հաշմանդամության, կերակրողին կորցնելու դեպքում սոցիալական նպաստներ",2021
10,2,1,4,ՀՀ օրենքներով նշանակված կենսաթոշակներ ,2021
10,2,1,5,Տարեցների եւ հաշմանդամություն ունեցող 18 տարին լրացած անձանց շուրջօրյա  խնամքի ծառայություններ,2021
10,2,1,6,Տնային  պայմաններում միայնակ տարեցների  սոցիալական սպասարկում,2021
10,2,1,7,"ՀՀ մարզերում միայնակ տարեցներին, հաշմանդամներին տնային պայմաններում եւ տարեցների ցերեկային խնամքի կենտրոններում սոցիալական սպասարկում",2021
10,2,1,8,Աշխատանքային կենսաթոշակներ,2021
10,2,1,9,Վանաձորի տարեցների տանը խնամվողներին շուրջօրյա խնամք եւ սոցիալական սպասարկում,2021
10,2,1,10,Կուտակային կենսաթոշակային համակարգի ներդնում,2021
10,2,1,11,Հատուկ խմբերին դասված որոշակի կատեգորիայի անձանց կացարանով ապահովման ծառայություններ,2021
10,2,1,12,Տնային խնամքի ծառայություններ հոգեկան առողջության խնդիրներ ունեցող անձանց համար,2021
10,2,1,13,Տեսողության խնդիրներ ունեցող անձանց սոցիալ-հոգեբանական վերականգնում,2021
10,2,1,14,Սոցիալական բնակարանային ֆոնդի  կացարաններում բնակվող միայնակ կենսաթոշակառուներին կոմունալ ծախսերի դիմաց դրամական փոխհատուցում,2021
10,2,1,15,18 տարեկանից բարձր տարիքի անձանց համայնքային փոքր տներում խնամքի կազմակերպման համար անշարժ գույքի ձեռքբերում,2021
